# 2026 March 16
#
# The author disclaims copyright to this source code.  In place of
# a legal notice, here is a blessing:
#
#    May you do good and not evil.
#    May you find forgiveness for yourself and forgive others.
#    May you share freely, never taking more than you give.
#
#***********************************************************************
#

set testdir [file dirname $argv0]
source $testdir/tester.tcl

# Check that OP_IdxDelete works when:
#
# 1.1.* The real value in the index is greater than that in the table,
# 1.2.* The real value in the index is smaller than that in the table,
# 1.3.* Duplicate distorted real values.
#

do_execsql_test 1.0.1 {
  CREATE TABLE t1(a INTEGER PRIMARY KEY, b REAL);
  INSERT INTO t1 VALUES(10, 10.0);
  INSERT INTO t1 VALUES(15, 15.0);
  INSERT INTO t1 VALUES(20, 20.0);
  INSERT INTO t1 VALUES(25, 25.0);
  INSERT INTO t1 VALUES(30, 30.0);
  CREATE INDEX i1 ON t1(b);
}

set root [db one {SELECT rootpage FROM sqlite_schema WHERE name='i1'}]

do_test 1.0.2 {
  # Create an imposter table for index i1
  sqlite3_test_control SQLITE_TESTCTRL_IMPOSTER db main 1 $root
  db eval {
    CREATE TABLE x1(b, rowid, PRIMARY KEY(b, rowid)) WITHOUT ROWID;
  }
  sqlite3_test_control SQLITE_TESTCTRL_IMPOSTER db main 0 0

  db one { PRAGMA integrity_check }
} ok

do_execsql_test 1.1.1 {
  UPDATE x1 SET b=21.0 WHERE rowid=20;
  PRAGMA integrity_check;
} {
  {row 3 missing from index i1}
}
do_execsql_test 1.1.2 {
  DELETE FROM t1 WHERE a=20;
} {}
do_execsql_test 1.1.3 {
  PRAGMA integrity_check;
} {ok}

do_execsql_test 1.2.1 {
  UPDATE x1 SET b=26.0 WHERE rowid=25;
  PRAGMA integrity_check;
} {
  {row 3 missing from index i1}
}
do_execsql_test 1.2.2 {
  DELETE FROM t1 WHERE a=25;
} {}
do_execsql_test 1.2.3 {
  PRAGMA integrity_check;
} {ok}

do_execsql_test 1.3.1 {
  DELETE FROM t1;
  INSERT INTO t1 VALUES(5,  15.0);
  INSERT INTO t1 VALUES(10, 20.0);
  INSERT INTO t1 VALUES(15, 20.0);
  INSERT INTO t1 VALUES(20, 20.0);
  INSERT INTO t1 VALUES(25, 20.0);
  INSERT INTO t1 VALUES(30, 20.0);
  INSERT INTO t1 VALUES(35, 25.0);

  UPDATE x1 SET b=19.0 WHERE b=20.0;
  PRAGMA integrity_check;
} {
  {row 2 missing from index i1} 
  {row 3 missing from index i1} 
  {row 4 missing from index i1} 
  {row 5 missing from index i1}
  {row 6 missing from index i1}
}

  # 1 15   2 30   3 20   4 10   5 25
foreach {tn a} {
  1 15
} {
breakpoint
  do_execsql_test 1.3.2.$tn {
    DELETE FROM t1 WHERE a=$a
  }
}


finish_test
